Enter password: ****
Welcome to the MySQL monitor.  Commands end with ; or \g.
Your MySQL connection id is 9
Server version: 9.0.0 MySQL Community Server - GPL

Copyright (c) 2000, 2024, Oracle and/or its affiliates.

Oracle is a registered trademark of Oracle Corporation and/or its
affiliates. Other names may be trademarks of their respective
owners.

Type 'help;' or '\h' for help. Type '\c' to clear the current input statement.

mysql> create database console_bank;
Query OK, 1 row affected (0.01 sec)

mysql> use console_bank;
Database changed
mysql> CREATE TABLE CUSTOMERS(CUSTOMER_ID INT PRIMARY KEY AUTO_INCREMENT, FIRST_NAME VARCHAR(50) NOT NULL, LAST_NAME VARCHAR(50) NOT NULL, CITY VARCHAR(50), JOIN_DATE DATE);
Query OK, 0 rows affected (0.04 sec)

mysql> INSERT INTO CUSTOMERS(FIRST_NAME,LAST_NAME,CITY,JOIN_DATE) VALUES ('AMAAN' , 'SAYYED' , 'PUNE', '2023-20-01'),('RAHUL','SHARMA','MUMBAI','2023-10-15'),('NEHA','PATIL','PUNE','2023-11-02');
ERROR 1292 (22007): Incorrect date value: '2023-20-01' for column 'JOIN_DATE' at row 1
mysql> INSERT INTO CUSTOMERS(FIRST_NAME,LAST_NAME,CITY,JOIN_DATE) VALUES ('AMAAN' , 'SAYYED' , 'PUNE', '2023-10-01'),('RAHUL','SHARMA','MUMBAI','2023-10-15'),('NEHA','PATIL','PUNE','2023-11-02');
Query OK, 3 rows affected (0.01 sec)
Records: 3  Duplicates: 0  Warnings: 0

mysql> SELECT * FROM CUSTOMER;
ERROR 1146 (42S02): Table 'console_bank.customer' doesn't exist
mysql> SELECT * FROM CUSTOMERS;
+-------------+------------+-----------+--------+------------+
| CUSTOMER_ID | FIRST_NAME | LAST_NAME | CITY   | JOIN_DATE  |
+-------------+------------+-----------+--------+------------+
|           1 | AMAAN      | SAYYED    | PUNE   | 2023-10-01 |
|           2 | RAHUL      | SHARMA    | MUMBAI | 2023-10-15 |
|           3 | NEHA       | PATIL     | PUNE   | 2023-11-02 |
+-------------+------------+-----------+--------+------------+
3 rows in set (0.00 sec)

mysql> SELECT FIRST_NAME,LAST_NAME FROM CUSTOMERS WHERE CITY = 'PUNE' ORDER BY LAST_NAME;
+------------+-----------+
| FIRST_NAME | LAST_NAME |
+------------+-----------+
| NEHA       | PATIL     |
| AMAAN      | SAYYED    |
+------------+-----------+
2 rows in set (0.00 sec)

mysql>  UPDATE CUSTOMERS SET CITY = 'MUMBAI' WHERE FIRST_NAME = 'NEHA';
Query OK, 1 row affected (0.01 sec)
Rows matched: 1  Changed: 1  Warnings: 0

mysql> SELECT * FROM CUSTOMERS;
+-------------+------------+-----------+--------+------------+
| CUSTOMER_ID | FIRST_NAME | LAST_NAME | CITY   | JOIN_DATE  |
+-------------+------------+-----------+--------+------------+
|           1 | AMAAN      | SAYYED    | PUNE   | 2023-10-01 |
|           2 | RAHUL      | SHARMA    | MUMBAI | 2023-10-15 |
|           3 | NEHA       | PATIL     | MUMBAI | 2023-11-02 |
+-------------+------------+-----------+--------+------------+
3 rows in set (0.00 sec)

mysql> CREATE TABLE ACCOUNTS(ACCOUNT_ID INT PRIMARY KEY AUTO_INCREMENT,CUSTOMER_ID INT,ACCOUNT_TYPE VARCHAR(20),BALANCE DECIMAL(10,2),FOREIGN KEY(CUSTOMER_ID) REFERENCES CUSTOMERS(CUSTOMERS_ID));
ERROR 3734 (HY000): Failed to add the foreign key constraint. Missing column 'CUSTOMERS_ID' for constraint 'accounts_ibfk_1' in the referenced table 'customers'
mysql> CREATE TABLE ACCOUNTS(ACCOUNT_ID INT PRIMARY KEY AUTO_INCREMENT,CUSTOMER_ID INT,ACCOUNT_TYPE VARCHAR(20),BALANCE DECIMAL(10,2),FOREIGN KEY(CUSTOMER_ID) REFERENCES CUSTOMERS(CUSTOMER_ID));
Query OK, 0 rows affected (0.03 sec)

mysql> INSERT INTO ACCOUNTS(CUSTOMER_ID,ACCOUNT_TYPE,BALANCE) VALUES(1,'SAVING',5000.00),(1,'CURRENT',2500.00),(2,'SAVING',12000.00),(3,'SAVING',800.00);
Query OK, 4 rows affected (0.00 sec)
Records: 4  Duplicates: 0  Warnings: 0

mysql> SELECT * FROM ACCOUNTS;
+------------+-------------+--------------+----------+
| ACCOUNT_ID | CUSTOMER_ID | ACCOUNT_TYPE | BALANCE  |
+------------+-------------+--------------+----------+
|          1 |           1 | SAVING       |  5000.00 |
|          2 |           1 | CURRENT      |  2500.00 |
|          3 |           2 | SAVING       | 12000.00 |
|          4 |           3 | SAVING       |   800.00 |
+------------+-------------+--------------+----------+
4 rows in set (0.00 sec)

mysql> SELECT CUSTOMER.FIRST_NAME,ACCOUNTS.ACCOUNT_TYPE,ACCOUNTS.BALANCE FROM CUSTOMERS INNER JOIN ACCOUNTS ON CUSTOMERS.CUSTOMER_ID = ACCOUNTS.CUSTOMER_ID;
ERROR 1054 (42S22): Unknown column 'CUSTOMER.FIRST_NAME' in 'field list'
mysql> SELECT CUSTOMERS.FIRST_NAME,ACCOUNTS.ACCOUNT_TYPE,ACCOUNTS.BALANCE FROM CUSTOMERS INNER JOIN ACCOUNTS ON CUSTOMERS.CUSTOMER_ID = ACCOUNTS.CUSTOMER_ID;
+------------+--------------+----------+
| FIRST_NAME | ACCOUNT_TYPE | BALANCE  |
+------------+--------------+----------+
| AMAAN      | SAVING       |  5000.00 |
| AMAAN      | CURRENT      |  2500.00 |
| RAHUL      | SAVING       | 12000.00 |
| NEHA       | SAVING       |   800.00 |
+------------+--------------+----------+
4 rows in set (0.00 sec)

mysql> SELECT CUSTOMERS.FIRST_NAME,ACCOUNTS.ACCOUNT_TYPE,ACCOUNTS.BALANCE FROM CUSTOMERS INNER JOIN ACCOUNTS ON CUSTOMERS.CUSTOMER_ID = ACCOUNTS.CUSTOMER_ID WHERE CUSTOMERS.CUSTOMER_ID=1;
+------------+--------------+---------+
| FIRST_NAME | ACCOUNT_TYPE | BALANCE |
+------------+--------------+---------+
| AMAAN      | SAVING       | 5000.00 |
| AMAAN      | CURRENT      | 2500.00 |
+------------+--------------+---------+
2 rows in set (0.00 sec)

mysql> SELECT CUSTOMERS.FIRST_NAME , SUM(ACCOUNTS.BALANCE) AS TOTAL_BALANCE FROM CUSTOMERS INNER JOINACCCOUNTS ON CUSTOMERS.CUSTOMER_ID = ACCOUNTS.CUSTOMER_ID GROUP BY CUSTOMERS.FIRST_NAME;
ERROR 1146 (42S02): Table 'console_bank.acccounts' doesn't exist
mysql> SELECT CUSTOMERS.FIRST_NAME , SUM(ACCOUNTS.BALANCE) AS TOTAL_BALANCE FROM CUSTOMERS INNER JOINACCOUNTS ON CUSTOMERS.CUSTOMER_ID = ACCOUNTS.CUSTOMER_ID GROUP BY CUSTOMERS.FIRST_NAME;
+------------+---------------+
| FIRST_NAME | TOTAL_BALANCE |
+------------+---------------+
| AMAAN      |       7500.00 |
| RAHUL      |      12000.00 |
| NEHA       |        800.00 |
+------------+---------------+
3 rows in set (0.00 sec)

mysql> START TRANSACTION;
Query OK, 0 rows affected (0.00 sec)

mysql> UPDATE ACCOUNTS SET BALANCE = BALANCE - 1000 WHERE ACCOUNT_ID = 1;
Query OK, 1 row affected (0.00 sec)
Rows matched: 1  Changed: 1  Warnings: 0

mysql> UPDATE ACCOUNTS SET BALANCE = BALANCE  1000 WHERE ACCOUNT_ID = 1;
ERROR 1064 (42000): You have an error in your SQL syntax; check the manual that corresponds to your MySQL server version for the right syntax to use near '1000 WHERE ACCOUNT_ID = 1' at line 1
mysql>
mysql> UPDATE ACCOUNTS SET BALANCE = BALANCE + 1000 WHERE ACCOUNT_ID = 4;
Query OK, 1 row affected (0.00 sec)
Rows matched: 1  Changed: 1  Warnings: 0

mysql> SELECT * FROM ACCOUNTS;
+------------+-------------+--------------+----------+
| ACCOUNT_ID | CUSTOMER_ID | ACCOUNT_TYPE | BALANCE  |
+------------+-------------+--------------+----------+
|          1 |           1 | SAVING       |  4000.00 |
|          2 |           1 | CURRENT      |  2500.00 |
|          3 |           2 | SAVING       | 12000.00 |
|          4 |           3 | SAVING       |  1800.00 |
+------------+-------------+--------------+----------+
4 rows in set (0.00 sec)

mysql> ROLLBACK;
Query OK, 0 rows affected (0.00 sec)

mysql> SELECT * FROM ACCOUNTS;
+------------+-------------+--------------+----------+
| ACCOUNT_ID | CUSTOMER_ID | ACCOUNT_TYPE | BALANCE  |
+------------+-------------+--------------+----------+
|          1 |           1 | SAVING       |  5000.00 |
|          2 |           1 | CURRENT      |  2500.00 |
|          3 |           2 | SAVING       | 12000.00 |
|          4 |           3 | SAVING       |   800.00 |
+------------+-------------+--------------+----------+
4 rows in set (0.00 sec)

mysql> CREATE TABLE TRANSACTIONHISTORY (TRANSACTION_ID INT PRIMARY KEY AUTO_INCREMENT,ACCOUNT_ID INT,TRANSACTION_TYPE VARCHAR(10),AMOUNT DECIMAL(10,2),TRANSACTION_DATE DATETIME DEFAULT CURRENT_TIMESTAMP,FOREIGN KEY (ACCOUNT_ID) REFERENCES ACCOUNTS(ACCOUNT_ID));
Query OK, 0 rows affected (0.03 sec)

mysql> DELIMITER //
mysql>
mysql> CREATE trigger AFTER_TRANSACTIION_INSERT
    -> AFTER insert ON TRANSACTIONHISTORY
    -> FOR each row
    -> BEGIN
    ->  IF NEW.TRANSACTION_TYPE = 'DEPOSIT' THEN
    ->     UPDATE ACCOUNTS SET BALANCE = BALANCE + NEW.ACCOUNT WHERE ACCOUNT_ID = NEW.ACCOUNT_ID;
    ->     elseif NEW.TRANSACTION_TYPE = 'WITHDRAW' THEN
    ->     UPDATE ACCOUNTS SET BALANCE = BALANCE = BALANCE - NEW.ACCOUNT_ID = NEW.ACCOUNT_ID;
    ->  end if;
    -> END
    -> DELIMITER ;
    -> DELIMITER //
ERROR 1064 (42000): You have an error in your SQL syntax; check the manual that corresponds to your MySQL server version for the right syntax to use near 'DELIMITER ;DELIMITER' at line 11
mysql>
mysql> CREATE TRIGGER After_Transaction_Insert
    -> AFTER INSERT ON TransactionHistory
    -> FOR EACH ROW
    -> BEGIN
    ->     IF NEW.transaction_type = 'DEPOSIT' THEN
    ->         UPDATE Accounts SET balance = balance + NEW.amount WHERE account_id = NEW.account_id;
    ->     ELSEIF NEW.transaction_type = 'WITHDRAW' THEN
    ->         UPDATE Accounts SET balance = balance - NEW.amount WHERE account_id = NEW.account_id;
    ->     END IF;
    -> END //
Query OK, 0 rows affected (0.01 sec)

mysql>
mysql> DELIMITER ;
mysql> INSERT INTO TransactionHistory (account_id, transaction_type, amount)
    -> VALUES (1, 'WITHDRAW', 500.00);
Query OK, 1 row affected (0.01 sec)

mysql> SELECT * FROM ACCOUNTS WHERE ACCOUNT_ID = 1;
+------------+-------------+--------------+---------+
| ACCOUNT_ID | CUSTOMER_ID | ACCOUNT_TYPE | BALANCE |
+------------+-------------+--------------+---------+
|          1 |           1 | SAVING       | 4500.00 |
+------------+-------------+--------------+---------+
1 row in set (0.00 sec)

mysql>
